{
  "$schema": "https://json-schema.org/draft/2020-12/schema",
  "$id": "https://supervisor.local/agents/schemas/research_report.json",
  "title": "research_report",
  "description": "A research report. Every finding carries the three mandatory sections: OBSERVATION (what a cited source shows), HYPOTHESIS (what we infer) and RECOMMENDATION (what we propose, with a confidence). Structure is enforced here; the counting rule 'a recommendation marked high confidence needs at least three sources on three different domains' needs the source table to resolve ids and is for the reviewer to check against the source table.",
  "type": "object",
  "additionalProperties": false,
  "required": ["kind", "schema_version", "id", "created", "task_ref", "topic", "findings", "sources"],
  "properties": {
    "kind": {"const": "research_report"},
    "schema_version": {"const": 1},
    "id": {"type": "string", "minLength": 1},
    "created": {"$ref": "#/$defs/timestamp"},
    "updated": {"$ref": "#/$defs/timestamp"},
    "task_ref": {"type": "string", "pattern": "^T[0-9]+-[0-9]+[a-z]?$", "description": "The research task this report answers, e.g. T1-03."},
    "topic": {"type": "string", "minLength": 1, "maxLength": 300},
    "question": {"type": "string", "maxLength": 1000, "description": "The question the report set out to answer."},
    "findings": {
      "type": "array",
      "minItems": 1,
      "items": {"$ref": "#/$defs/finding"}
    },
    "sources": {
      "type": "array",
      "minItems": 1,
      "description": "Every source consulted, with its retrieval date. Keep the same table in docs/research/sources.yaml when the project tracks sources across reports.",
      "items": {"$ref": "#/$defs/source"}
    },
    "gaps": {
      "type": "array",
      "description": "Questions the available sources could not answer. Stating a gap is preferred over filling it with a guess.",
      "items": {"type": "string", "minLength": 1}
    },
    "second_opinion": {
      "type": "object",
      "additionalProperties": false,
      "required": ["lane", "agreements", "disagreements"],
      "description": "A synthesis of the same corpus by the other vendor lane, attached to reduce single-vendor bias.",
      "properties": {
        "lane": {"type": "string", "minLength": 1},
        "agreements": {"type": "array", "items": {"type": "string", "minLength": 1}},
        "disagreements": {"type": "array", "items": {"type": "string", "minLength": 1}}
      }
    }
  },
  "$defs": {
    "timestamp": {
      "type": "string",
      "format": "date-time",
      "pattern": "^[0-9]{4}-[0-9]{2}-[0-9]{2}T[0-9]{2}:[0-9]{2}:[0-9]{2}([.][0-9]+)?(Z|[+-][0-9]{2}:[0-9]{2})$",
      "description": "ISO-8601 with an explicit offset, as supervisor.store.now_iso() writes it. The pattern is carried next to 'format' on purpose: no RFC-3339 format checker is installed, so without it the format keyword would be annotation only."
    },
    "finding_id": {"type": "string", "pattern": "^F[0-9]{1,3}$"},
    "source_id": {"type": "string", "pattern": "^S[0-9]{1,3}$"},
    "finding": {
      "type": "object",
      "additionalProperties": false,
      "required": ["id", "observation", "hypothesis", "recommendation"],
      "properties": {
        "id": {"$ref": "#/$defs/finding_id"},
        "observation": {
          "type": "object",
          "additionalProperties": false,
          "required": ["statement", "source_ids"],
          "description": "OBSERVATION: only what the cited sources show. An anecdote is allowed here but can never be the sole support of a recommendation.",
          "properties": {
            "statement": {"type": "string", "minLength": 1, "maxLength": 2000},
            "source_ids": {"type": "array", "minItems": 1, "uniqueItems": true, "items": {"$ref": "#/$defs/source_id"}}
          }
        },
        "hypothesis": {"type": "string", "minLength": 1, "maxLength": 2000, "description": "HYPOTHESIS: the inference drawn from the observation, stated so it could be wrong."},
        "recommendation": {
          "type": "object",
          "additionalProperties": false,
          "required": ["statement", "confidence", "source_ids"],
          "description": "RECOMMENDATION: what we propose. 'high' confidence requires at least three sources on three distinct domains (reviewers check this against the source table).",
          "properties": {
            "statement": {"type": "string", "minLength": 1, "maxLength": 2000},
            "confidence": {"enum": ["low", "medium", "high"]},
            "source_ids": {"type": "array", "minItems": 1, "uniqueItems": true, "items": {"$ref": "#/$defs/source_id"}}
          }
        },
        "tags": {"type": "array", "items": {"type": "string", "minLength": 1}}
      }
    },
    "source": {
      "type": "object",
      "additionalProperties": false,
      "required": ["id", "url", "title", "publisher", "type", "retrieved"],
      "properties": {
        "id": {"$ref": "#/$defs/source_id"},
        "url": {"type": "string", "pattern": "^https?://[^\\s]+$"},
        "title": {"type": "string", "minLength": 1, "maxLength": 300},
        "publisher": {"type": "string", "minLength": 1, "maxLength": 200, "description": "Publishing domain or organisation; independence is judged on this."},
        "type": {"enum": ["platform_docs", "policy", "marketing_research", "news", "community", "competitor_profile", "visual_trend", "academic", "other"]},
        "retrieved": {"type": "string", "format": "date", "pattern": "^[0-9]{4}-[0-9]{2}-[0-9]{2}$", "description": "YYYY-MM-DD the page was fetched."},
        "published": {"type": "string", "description": "Publication date as the source states it; prefer recent, dated sources."},
        "note": {"type": "string", "maxLength": 500}
      }
    }
  }
}
